{
  "schema_version": "1.0.0",
  "suite": "cross-language-v1",
  "timestamp_utc": "2026-08-20T00:20:59Z",
  "target": {
    "language": "java",
    "implementation": "vinary-tree",
    "backend": "jvm-ffm",
    "runtime_version": "OpenJDK 64-Bit Server VM 26.0.2",
    "library_version": "0.10.0",
    "artifact": {
      "kind": "local-build",
      "id": "io.vinarytree:liblevenshtein:0.10.0"
    }
  },
  "dictionary": {
    "file": "/home/dylon/Workspace/f1r3fly.io/liblevenshtein-rust/benchmarks/cross-language/workload/dictionary.txt",
    "term_count": 79343,
    "structure": "dynamic_dawg",
    "unit_domain": "unicode_scalar",
    "construct_ns": 271254218,
    "sha256": "ec4c78c63325d87902c11ab65e16c6020ba478326a351acf632c44467e893f23"
  },
  "workload": {
    "queryset": "tr-d3",
    "file": "/home/dylon/Workspace/f1r3fly.io/liblevenshtein-rust/benchmarks/cross-language/workload/queries/tr-d3.txt",
    "query_count": 1000,
    "sha256": "611f6af44bf4b7bd6c1ab477b24446cfc15906d3bb92822f6b4b20894955a1da"
  },
  "algorithm": "damerau_levenshtein",
  "max_distance": 3,
  "mode": "verify",
  "protocol": {
    "timer": "monotonic",
    "harness": "self-timed",
    "warmup_seconds_min": 3.0,
    "warmup_passes": 0,
    "samples_requested": 0,
    "sample_definition": "one full pass over the query set; every cursor fully drained and (term, distance) materialized",
    "batch_size": 256,
    "wall_cap_seconds": 300
  },
  "measurements": {
    "samples_ns": [],
    "sample_count": 0,
    "matches_per_pass": 128873,
    "term_bytes_per_pass": 586152,
    "distance_sum_per_pass": 376328,
    "checksum_hex": "88eca11129e602ad"
  },
  "status": "ok",
  "notes": [],
  "run_id": "jvm-parity-full",
  "environment_ref": "../environment.json",
  "cell_snapshot": {
    "cpuset": "16-31",
    "cpu_mhz_start": 3494.1,
    "cpu_mhz_end": 3567.6,
    "load_avg_1m": 4.2
  },
  "native_digests": {
    "libliblevenshtein.so": "3b166329982de1ea1db734613f8bc525322196eed8addb0e6d893f4ae6769009",
    "liblibdictenstein.so": "2f4d400828e0d34fdc160417a408e30b4ddf9145f95760cb5331ba62d108cad4"
  }
}
