{
  "schema_version": "1.0.0",
  "suite": "cross-language-v1",
  "timestamp_utc": "2026-08-20T01:41:39+00:00",
  "target": {
    "language": "java",
    "implementation": "legacy",
    "backend": "jvm-legacy-jar",
    "runtime_version": "openjdk 26.0.2 2026-07-21",
    "library_version": "3.0.0",
    "artifact": {
      "kind": "maven",
      "id": "com.github.universal-automata:liblevenshtein:3.0.0"
    }
  },
  "dictionary": {
    "file": "/home/dylon/Workspace/f1r3fly.io/liblevenshtein-rust/benchmarks/cross-language/workload/dictionary.txt",
    "sha256": "ec4c78c63325d87902c11ab65e16c6020ba478326a351acf632c44467e893f23",
    "term_count": 79343,
    "structure": "legacy_sorted_dawg",
    "unit_domain": "jvm_string"
  },
  "workload": {
    "queryset": "hits",
    "file": "/home/dylon/Workspace/f1r3fly.io/liblevenshtein-rust/benchmarks/cross-language/workload/queries/hits.txt",
    "sha256": "58ad53d48923b61d09e8115c96629e6010c94d289c67cc6a1cbc825b5be5a35e",
    "query_count": 1000
  },
  "algorithm": "transposition",
  "max_distance": 1,
  "mode": "query",
  "protocol": {
    "timer": "monotonic",
    "harness": "jmh",
    "warmup_seconds_min": 0,
    "warmup_passes": 5,
    "samples_requested": 20,
    "sample_definition": "one full pass over the query set; every cursor fully drained and (term, distance) materialized",
    "batch_size": null,
    "wall_cap_seconds": 0,
    "jmh": {
      "forks": 2,
      "warmup_iterations": 5,
      "measurement_iterations": 10,
      "iteration_seconds": 2
    }
  },
  "measurements": {
    "samples_ns": [
      54498428,
      54741953,
      53671892,
      54604937,
      55364191,
      53466137,
      54066524,
      54591198,
      52668968,
      52826522,
      53573985,
      53291097,
      53204009,
      53646726,
      53965276,
      53052066,
      52932555,
      52926143,
      53961399,
      52678695
    ],
    "sample_count": 20,
    "matches_per_pass": 3634,
    "term_bytes_per_pass": 24791,
    "distance_sum_per_pass": 2634,
    "checksum_hex": "527bb88ad1e839e5"
  },
  "status": "ok",
  "notes": [
    "converted from JMH record bench.LegacyBench.fullPass",
    "JVM result transport: materialized",
    "correctness evidence (triple+checksum) copied from the full-coverage verify twin over all 1000 queries \u2014 the same pass JMH timed"
  ],
  "run_id": "jvm-parity-full",
  "environment_ref": "../environment.json",
  "cell_snapshot": {
    "cpuset": "2-9",
    "cpu_mhz_start": 3567.9,
    "cpu_mhz_end": 1429.0,
    "load_avg_1m": 6.67
  }
}
