{
  "schema_version": "1.0.0",
  "suite": "cross-language-v1",
  "timestamp_utc": "2026-08-20T01:58:58+00:00",
  "target": {
    "language": "java",
    "implementation": "vinary-tree",
    "backend": "jvm-ffm",
    "runtime_version": "openjdk 26.0.2 2026-07-21",
    "library_version": "0.10.0",
    "artifact": {
      "kind": "local-build",
      "id": "io.vinarytree:liblevenshtein:0.10.0"
    }
  },
  "dictionary": {
    "file": "/home/dylon/Workspace/f1r3fly.io/liblevenshtein-rust/benchmarks/cross-language/workload/dictionary.txt",
    "sha256": "ec4c78c63325d87902c11ab65e16c6020ba478326a351acf632c44467e893f23",
    "term_count": 79343,
    "structure": "dynamic_dawg",
    "unit_domain": "unicode_scalar"
  },
  "workload": {
    "queryset": "tr-d1",
    "file": "/home/dylon/Workspace/f1r3fly.io/liblevenshtein-rust/benchmarks/cross-language/workload/queries/tr-d1.txt",
    "sha256": "1d6b1aba3768e83e35997bdab8b31507f875d036d38fd6604d3c686d140fe81a",
    "query_count": 1000
  },
  "algorithm": "transposition",
  "max_distance": 2,
  "mode": "query",
  "protocol": {
    "timer": "monotonic",
    "harness": "jmh",
    "warmup_seconds_min": 0,
    "warmup_passes": 5,
    "samples_requested": 20,
    "sample_definition": "one full pass over the query set; every cursor fully drained and (term, distance) materialized",
    "batch_size": 256,
    "wall_cap_seconds": 0,
    "jmh": {
      "forks": 2,
      "warmup_iterations": 5,
      "measurement_iterations": 10,
      "iteration_seconds": 2
    }
  },
  "measurements": {
    "samples_ns": [
      102375408,
      102509018,
      105568383,
      105806832,
      104657234,
      101720787,
      101798085,
      103476285,
      103839338,
      102457100,
      101806841,
      101738756,
      105844652,
      105536952,
      105427753,
      101506060,
      101875942,
      102372666,
      101903029,
      102533836
    ],
    "sample_count": 20,
    "matches_per_pass": 23294,
    "term_bytes_per_pass": 115523,
    "distance_sum_per_pass": 44489,
    "checksum_hex": "60b4533c3ae282fe"
  },
  "status": "ok",
  "notes": [
    "converted from JMH record bench.VinaryBench.fullPass",
    "JVM result transport: materialized",
    "correctness evidence (triple+checksum) copied from the full-coverage verify twin over all 1000 queries \u2014 the same pass JMH timed"
  ],
  "run_id": "jvm-parity-full",
  "environment_ref": "../environment.json",
  "cell_snapshot": {
    "cpuset": "2-9",
    "cpu_mhz_start": 4016.1,
    "cpu_mhz_end": 4159.6,
    "load_avg_1m": 6.22
  },
  "native_digests": {
    "libliblevenshtein.so": "3b166329982de1ea1db734613f8bc525322196eed8addb0e6d893f4ae6769009",
    "liblibdictenstein.so": "2f4d400828e0d34fdc160417a408e30b4ddf9145f95760cb5331ba62d108cad4"
  }
}
