{
  "schema_version": "1.0.0",
  "suite": "cross-language-v1",
  "timestamp_utc": "2026-08-20T00:22:50Z",
  "target": {
    "language": "java",
    "implementation": "legacy",
    "backend": "jvm-legacy-jar",
    "runtime_version": "OpenJDK 64-Bit Server VM 26.0.2",
    "library_version": "3.0.0",
    "artifact": {
      "kind": "maven",
      "id": "com.github.universal-automata:liblevenshtein:3.0.0"
    }
  },
  "dictionary": {
    "file": "/home/dylon/Workspace/f1r3fly.io/liblevenshtein-rust/benchmarks/cross-language/workload/dictionary.txt",
    "term_count": 79343,
    "structure": "legacy_sorted_dawg",
    "unit_domain": "jvm_string",
    "construct_ns": 222279525,
    "sha256": "ec4c78c63325d87902c11ab65e16c6020ba478326a351acf632c44467e893f23"
  },
  "workload": {
    "queryset": "std-d1",
    "file": "/home/dylon/Workspace/f1r3fly.io/liblevenshtein-rust/benchmarks/cross-language/workload/queries/std-d1.txt",
    "query_count": 1000,
    "sha256": "5add495226b1db1f1a89af0dd2d4e9ead306e4d76bae8379f54aa3c13c4ec0d3"
  },
  "algorithm": "merge_and_split",
  "max_distance": 2,
  "mode": "verify",
  "protocol": {
    "timer": "monotonic",
    "harness": "self-timed",
    "warmup_seconds_min": 3.0,
    "warmup_passes": 0,
    "samples_requested": 0,
    "sample_definition": "one full pass over the query set; every cursor fully drained and (term, distance) materialized",
    "batch_size": null,
    "wall_cap_seconds": 300
  },
  "measurements": {
    "samples_ns": [],
    "sample_count": 0,
    "matches_per_pass": 226953,
    "term_bytes_per_pass": 1098781,
    "distance_sum_per_pass": 448513,
    "checksum_hex": "c29d6d544233ab28"
  },
  "status": "ok",
  "notes": [],
  "run_id": "jvm-parity-full",
  "environment_ref": "../environment.json",
  "cell_snapshot": {
    "cpuset": "16-31",
    "cpu_mhz_start": 3512.4,
    "cpu_mhz_end": 3977.1,
    "load_avg_1m": 4.87
  }
}
